{"contract_c_version":"1.0.0","execution":{"state":"completed"},"input":{"contract_b":{"bundle_hash":"sha256:a40fe687c19944248fe77d044801dca02bba56259198b297b897f6a5a304f2fa","bundle_id":"85f8f6dc-f46f-5efa-b7e7-6e049da84591","contract_version":"1.2.0"}},"producer":{"policy":{"canonical":{"candidate_admission":0.4,"config_id":"cal-rules-v1.2.0","counterevidence_weight":0.3,"false_caution_detection":true,"false_caution_threshold":0.85,"needs_source_detection":true,"overstated_detection":true,"partial_support":0.55,"require_passage_level_match":true,"sourced_support":0.8},"sha256":"88f007c96f3acf63a191556fe7fa46b80b37e9fcb5224ec1e90fb626a061104d"},"semantic_implementation_sha":"33a928db97316a3652d57df9cafb8ca240305233"},"propositions":[{"assessments":{"aperture_completeness":{"state":"not_performed"},"eligibility":{"state":"not_performed"},"semantic_validity":{"state":"not_performed"},"temporal_applicability":{"state":"not_performed"}},"conclusion":{"basis_members":[{"id":"contribution:32d3816b8706ac75adeb7e6333eded808d2411f7107c7456a87a747012647431","namespace":"contribution"}],"causal_form":"single_necessary","reported_verdict":"partially_supported","residual_contribution_ids":["contribution:438fda008996923dc0d0a1b05b81fcb87c40560facf828b6883ef7526b0e9384"],"rule_roles":[],"terminal_branch":"support_between_thresholds"},"contributions":[{"channel":"support","contribution_id":"contribution:32d3816b8706ac75adeb7e6333eded808d2411f7107c7456a87a747012647431","evidence_ref":{"passage_id":"auto-src-md-947b3344e6db","passage_sha256":"sha256:7d8968f45e479f53674ab916aca5d6653e81a13555b53d88ec3e681d2767e40d","source_id":"src-md"}},{"channel":"support","contribution_id":"contribution:438fda008996923dc0d0a1b05b81fcb87c40560facf828b6883ef7526b0e9384","evidence_ref":{"passage_id":"auto-src-md-8c9a661c168a","passage_sha256":"sha256:2f47759502a48d6f5899e3973b22cef34afa5dd6055d5ef15f8b3792e2a341d8","source_id":"src-md"}}],"execution":{"completion":"assessed","state":"completed"},"measurement":{"basis_contribution_ids":["contribution:32d3816b8706ac75adeb7e6333eded808d2411f7107c7456a87a747012647431"],"kind":"cal_v0_2_aggregate_support_signal","value":0.6075},"proposition":{"proposition_id":"clm-md","text_sha256":"f3def40d37574fefac4394afc24840423ec1cfa3545870ea05c1da7446d53fab"}},{"assessments":{"aperture_completeness":{"state":"not_performed"},"eligibility":{"state":"not_performed"},"semantic_validity":{"state":"not_performed"},"temporal_applicability":{"state":"not_performed"}},"conclusion":{"basis_members":[{"id":"contribution:969f9a8ff0cee98499e2ff92aba373cc7510635ece34dba61dcdcd69fa772c4b","namespace":"contribution"}],"causal_form":"single_necessary","reported_verdict":"partially_supported","residual_contribution_ids":[],"rule_roles":[{"code":"low_reliability_only","rule_id":"rule-role:clm-pdf:low_reliability_only","terminal_role":"residual"}],"terminal_branch":"support_between_thresholds"},"contributions":[{"channel":"support","contribution_id":"contribution:969f9a8ff0cee98499e2ff92aba373cc7510635ece34dba61dcdcd69fa772c4b","evidence_ref":{"passage_id":"auto-src-pdf-9a37acc6172e","passage_sha256":"sha256:3f567eff5988314052f64dff971217d44b905469862ffaa0d697094bf55655f0","source_id":"src-pdf"}}],"execution":{"completion":"assessed","state":"completed"},"measurement":{"basis_contribution_ids":["contribution:969f9a8ff0cee98499e2ff92aba373cc7510635ece34dba61dcdcd69fa772c4b"],"kind":"cal_v0_2_aggregate_support_signal","value":0.6148},"proposition":{"proposition_id":"clm-pdf","text_sha256":"6a65fdc18ae860d22a731fcf814455c2a10dd7f4ef0331ea67c12384cd37fe40"}},{"assessments":{"aperture_completeness":{"state":"not_performed"},"eligibility":{"state":"not_performed"},"semantic_validity":{"state":"not_performed"},"temporal_applicability":{"state":"not_performed"}},"conclusion":{"basis_members":[],"causal_form":"redundant_non_deciding","reported_verdict":"unsupported","residual_contribution_ids":["contribution:76b9c2a0eb6b3d054e0ea584391fc7cb3a8ad901ab7c1656663e0446659d8ddf"],"rule_roles":[{"code":"low_reliability_only","rule_id":"rule-role:clm-txt:low_reliability_only","terminal_role":"residual"}],"terminal_branch":"support_below_partial_threshold"},"contributions":[{"channel":"support","contribution_id":"contribution:76b9c2a0eb6b3d054e0ea584391fc7cb3a8ad901ab7c1656663e0446659d8ddf","evidence_ref":{"passage_id":"auto-src-txt-0cafa46bd78b","passage_sha256":"sha256:0823b6706c533ed11787a88a69ed45c6dc9cb671daa69aeb8c18940a43dadf1e","source_id":"src-txt"}}],"execution":{"completion":"assessed","state":"completed"},"measurement":{"basis_contribution_ids":["contribution:76b9c2a0eb6b3d054e0ea584391fc7cb3a8ad901ab7c1656663e0446659d8ddf"],"kind":"cal_v0_2_aggregate_support_signal","value":0.4474},"proposition":{"proposition_id":"clm-txt","text_sha256":"09bd2d4cf1493718fdf2d130ff37c3aee30f38836009c01560409e6642fe7f9f"}}],"result_set_id":"result-set:44acdb85b76560b087aabeae576fb500a39ce506d3824570299637a2b16c3843"}
